{
  "schema_version": "1.0.0",
  "register_id": "skillregister",
  "letzte_aenderung": "2026-05-16T06:23:00.000000+00:00",
  "eintraege": [
    {
      "skill_id": "SKILL_OCR",
      "skillname": "OCR-Pipeline",
      "skillgruppe": "ocr_fundstellen",
      "zweck": "Texterkennung in Bildern und PDFs",
      "eingabe": "Dokument (Bild/PDF)",
      "ausgabe": "Strukturierter Text mit Layout-Metadaten",
      "verwendete_tools": ["TESSERACT", "PYMUPDF", "PILLOW"],
      "benoetigte_ressourcen": ["TESS_DEU", "TESS_FRA", "TESS_ENG", "TESS_SWE", "TESS_POL", "TESS_SPA", "TESS_NLD"],
      "benoetigte_quellen": [],
      "modellabhaengigkeit": "tesseract",
      "offline_moeglich": true,
      "online_erforderlich": false,
      "fallback": "manuell",
      "darf_bewerten": false,
      "darf_beweiswuerdigen": false,
      "darf_rechtsbewertung": false,
      "darf_stammdaten_aendern": false,
      "darf_originale_veraendern": false,
      "status": "gesperrt",
      "pruefstatus": "ungeprueft",
      "teststatus": "ungeprueft",
      "sicherheitsstufe": "hoch",
      "warnungen": [
        "Durch Altbestandsinventarisierung ermittelt.",
        "Erzeugt keine Originalveraenderungen."
      ]
    },
    {
      "skill_id": "SKILL_DOKUMENTART",
      "skillname": "Dokumentart erkennen",
      "skillgruppe": "dokument_voranalyse",
      "zweck": "Erkennt die Art eines Dokuments (Klage, Schreiben, Urteil, Vertrag, etc.)",
      "eingabe": "Dokument oder OCR-Ergebnis",
      "ausgabe": "Dokumentart-Vorschlag mit Konfidenz",
      "verwendete_tools": ["OLLAMA"],
      "benoetigte_ressourcen": [],
      "benoetigte_quellen": [],
      "modellabhaengigkeit": "ollama",
      "offline_moeglich": true,
      "online_erforderlich": false,
      "fallback": "manuell",
      "darf_bewerten": false,
      "darf_beweiswuerdigen": false,
      "darf_rechtsbewertung": false,
      "darf_stammdaten_aendern": false,
      "darf_originale_veraendern": false,
      "status": "gesperrt",
      "pruefstatus": "ungeprueft",
      "teststatus": "ungeprueft",
      "sicherheitsstufe": "normal",
      "warnungen": [
        "Durch Altbestandsinventarisierung ermittelt.",
        "Nur Vorschlag, keine endgueltige Klassifikation."
      ]
    },
    {
      "skill_id": "SKILL_SACHVERHALTSBEZUG",
      "skillname": "Sachverhaltsbezug herstellen",
      "skillgruppe": "dokument_voranalyse",
      "zweck": "Verknuepft Dokumentinhalte mit Akten-Sachverhalt",
      "eingabe": "OCR-Ergebnis und Akten-Kontext",
      "ausgabe": "Relevanz-Einschaetzung mit Hinweisen",
      "verwendete_tools": ["OLLAMA", "SQLITE"],
      "benoetigte_ressourcen": [],
      "benoetigte_quellen": [],
      "modellabhaengigkeit": "ollama",
      "offline_moeglich": true,
      "online_erforderlich": false,
      "fallback": "manuell",
      "darf_bewerten": false,
      "darf_beweiswuerdigen": false,
      "darf_rechtsbewertung": false,
      "darf_stammdaten_aendern": false,
      "darf_originale_veraendern": false,
      "status": "gesperrt",
      "pruefstatus": "ungeprueft",
      "teststatus": "ungeprueft",
      "sicherheitsstufe": "normal",
      "warnungen": [
        "Durch Altbestandsinventarisierung ermittelt.",
        "Nur Vorschlag, keine endgueltige Zuordnung."
      ]
    },
    {
      "skill_id": "SKILL_SPRACHE",
      "skillname": "Sprache erkennen und uebersetzen",
      "skillgruppe": "sprache_uebersetzung",
      "zweck": "Sprachliche Analyse, Erkennung und Uebersetzung",
      "eingabe": "Dokument oder Textauszug",
      "ausgabe": "Sprachprofil und optional Uebersetzungsvorschlag",
      "verwendete_tools": ["ARGOS_TRANSLATE", "OLLAMA"],
      "benoetigte_ressourcen": ["ARGOS_DE_EN", "ARGOS_DE_FR", "ARGOS_DE_ES", "ARGOS_DE_PL", "ARGOS_DE_NL", "ARGOS_DE_SV"],
      "benoetigte_quellen": ["IATE", "DGT_TRANSLATION_MEMORY"],
      "modellabhaengigkeit": "argos_translate",
      "offline_moeglich": true,
      "online_erforderlich": false,
      "fallback": "manuell",
      "darf_bewerten": false,
      "darf_beweiswuerdigen": false,
      "darf_rechtsbewertung": false,
      "darf_stammdaten_aendern": false,
      "darf_originale_veraendern": false,
      "status": "gesperrt",
      "pruefstatus": "ungeprueft",
      "teststatus": "ungeprueft",
      "sicherheitsstufe": "hoch",
      "warnungen": [
        "Durch Altbestandsinventarisierung ermittelt.",
        "Nur Vorschlag, keine verbindliche Uebersetzung.",
        "Rechtsterminologie erfordert Fachanwaltspruefung."
      ]
    },
    {
      "skill_id": "SKILL_QUELLEN",
      "skillname": "Quellenbetreuung",
      "skillgruppe": "quellen_adapter",
      "zweck": "Verwaltung und Pruefung von Rechtsquellen",
      "eingabe": "Rechtliche Fragestellung oder Fundstelle",
      "ausgabe": "Quellenhinweis mit Status und Warnung",
      "verwendete_tools": ["PYTHON", "SQLITE"],
      "benoetigte_ressourcen": ["QUELLEN_EU_SE", "ADAPTER_HEALTHCHECK", "CACHE_OFFLINE"],
      "benoetigte_quellen": ["EUR_LEX", "ECLI", "EU_JUSTIZPORTAL", "IATE"],
      "modellabhaengigkeit": "keine",
      "offline_moeglich": false,
      "online_erforderlich": true,
      "fallback": "manuell",
      "darf_bewerten": false,
      "darf_beweiswuerdigen": false,
      "darf_rechtsbewertung": false,
      "darf_stammdaten_aendern": false,
      "darf_originale_veraendern": false,
      "status": "gesperrt",
      "pruefstatus": "ungeprueft",
      "teststatus": "ungeprueft",
      "sicherheitsstufe": "kritisch",
      "warnungen": [
        "Durch Altbestandsinventarisierung ermittelt.",
        "Quellen duerfen erst nach Fachanwaltsraster verwendet werden.",
        "Keine automatische Rechtsbewertung."
      ]
    },
    {
      "skill_id": "SKILL_DATEITYP",
      "skillname": "Dateityp erkennen",
      "skillgruppe": "eingang_briefkasten",
      "zweck": "Erkennt den Dateityp und prueft auf Unterstuetzung",
      "eingabe": "Datei-Pfad oder Datei-Stream",
      "ausgabe": "Dateityp-Klassifikation und Unterstuetzungsstatus",
      "verwendete_tools": ["PYTHON"],
      "benoetigte_ressourcen": [],
      "benoetigte_quellen": [],
      "modellabhaengigkeit": "keine",
      "offline_moeglich": true,
      "online_erforderlich": false,
      "fallback": "manuell",
      "darf_bewerten": false,
      "darf_beweiswuerdigen": false,
      "darf_rechtsbewertung": false,
      "darf_stammdaten_aendern": false,
      "darf_originale_veraendern": false,
      "status": "gesperrt",
      "pruefstatus": "ungeprueft",
      "teststatus": "ungeprueft",
      "sicherheitsstufe": "normal",
      "warnungen": [
        "Nur Vorschlag, keine endgueltige Klassifikation."
      ]
    },
    {
      "skill_id": "SKILL_SICHERHEITSSTATUS",
      "skillname": "Sicherheitsstatus erkennen",
      "skillgruppe": "eingang_briefkasten",
      "zweck": "Erkennt potenzielle Sicherheitsprobleme (Viren, Malware, Suspicious)",
      "eingabe": "Datei-Metadaten und Hash",
      "ausgabe": "Sicherheits-Einschaetzung mit Hinweisen",
      "verwendete_tools": ["PYTHON"],
      "benoetigte_ressourcen": ["PWABSTRAKT"],
      "benoetigte_quellen": [],
      "modellabhaengigkeit": "keine",
      "offline_moeglich": true,
      "online_erforderlich": false,
      "fallback": "manuell",
      "darf_bewerten": false,
      "darf_beweiswuerdigen": false,
      "darf_rechtsbewertung": false,
      "darf_stammdaten_aendern": false,
      "darf_originale_veraendern": false,
      "status": "gesperrt",
      "pruefstatus": "ungeprueft",
      "teststatus": "ungeprueft",
      "sicherheitsstufe": "kritisch",
      "warnungen": [
        "Nur Heuristik, kein Ersatz fuer Virenscanner.",
        "Kritische Dateien muessen in Quarantaene."
      ]
    },
    {
      "skill_id": "SKILL_PASSWORTSCHUTZ",
      "skillname": "Passwortschutz erkennen",
      "skillgruppe": "eingang_briefkasten",
      "zweck": "Erkennt passwortgeschuetzte oder verschluesselte Dokumente",
      "eingabe": "Datei-Header und Metadaten",
      "ausgabe": "Passwortschutz-Status mit Hinweis",
      "verwendete_tools": ["PYTHON", "PYMUPDF"],
      "benoetigte_ressourcen": [],
      "benoetigte_quellen": [],
      "modellabhaengigkeit": "keine",
      "offline_moeglich": true,
      "online_erforderlich": false,
      "fallback": "manuell",
      "darf_bewerten": false,
      "darf_beweiswuerdigen": false,
      "darf_rechtsbewertung": false,
      "darf_stammdaten_aendern": false,
      "darf_originale_veraendern": false,
      "status": "gesperrt",
      "pruefstatus": "ungeprueft",
      "teststatus": "ungeprueft",
      "sicherheitsstufe": "hoch",
      "warnungen": [
        "Nur Erkennung, keine Entschluesselung."
      ]
    },
    {
      "skill_id": "SKILL_SIGNATURHINWEIS",
      "skillname": "Signaturhinweis erkennen",
      "skillgruppe": "eingang_briefkasten",
      "zweck": "Erkennt elektronische Signaturen und qualifizierte Signaturen",
      "eingabe": "Datei-Metadaten und Zertifikats-Info",
      "ausgabe": "Signatur-Status mit Hinweis",
      "verwendete_tools": ["PYTHON"],
      "benoetigte_ressourcen": [],
      "benoetigte_quellen": [],
      "modellabhaengigkeit": "keine",
      "offline_moeglich": true,
      "online_erforderlich": false,
      "fallback": "manuell",
      "darf_bewerten": false,
      "darf_beweiswuerdigen": false,
      "darf_rechtsbewertung": false,
      "darf_stammdaten_aendern": false,
      "darf_originale_veraendern": false,
      "status": "gesperrt",
      "pruefstatus": "ungeprueft",
      "teststatus": "ungeprueft",
      "sicherheitsstufe": "hoch",
      "warnungen": [
        "Nur Hinweis, keine Beweiswuerdigung der Signatur."
      ]
    },
    {
      "skill_id": "SKILL_CONTAINER_ZIP",